title,link,date,content,clean_content,date_only
Заголовок отсутствует,https://lenta.ru/news/2024/12/12/byvshego-voenkoma-rossiyskogo-goroda-osudili-na-10-let-za-vzyatki-ot-prizyvnikov/,2024-12-12 19:10:09.389862,"Якутский городской суд приговорил к 10 годам лишения свободы бывшего военного комиссара города за получение взяток от призывников. Об этом «Ленте.ру» сообщили в объединенной пресс-службе судов региона.Подсудимый признан виновным в совершении восьми преступных эпизодов. Его отправят в колонию строгого режима. Также экс-военкома лишили права занимать должности на госслужбе на срок 10 лет после отбытия наказания. Суд взыскал с него в доход государства 892 тысячи рублей, которые он получил коррупционным путем. Осужденный был взят под стражу в зале суда.По версии следствия, военком с 2019 по 2022 год получил от восьми призывников незаконное вознаграждение за освобождение от прохождения военной службы в Вооруженных силах России. На суде он отверг вину по семи преступлениям, а по восьмому эпизоду признался частично.22 июля 2022 года силовики задержали военкома Якутска Афанасия Захарова после обыска в квартире.",якутский городской суд приговорил к  годам лишения свободы бывшего военного комиссара города за получение взяток от призывников об этом ленте ру сообщили в объединенной пресс службе судов региона подсудимый признан виновным в совершении восьми преступных эпизодов его отправят в колонию строгого режима также экс военкома лишили права занимать должности на госслужбе на срок  лет после отбытия наказания суд взыскал с него в доход государства  тысячи рублей которые он получил коррупционным путем осужденный был взят под стражу в зале суда по версии следствия военком с  по  год получил от восьми призывников незаконное вознаграждение за освобождение от прохождения военной службы в вооруженных силах россии на суде он отверг вину по семи преступлениям а по восьмому эпизоду признался частично  июля  года силовики задержали военкома якутска афанасия захарова после обыска в квартире,2024-12-12
Заголовок отсутствует,https://lenta.ru/news/2024/12/12/jilyo-sdelki/,2024-12-12 19:10:09.744515,"Россияне стали реже приобретать жилье. О снижении уровня продаж на отечественном рынке недвижимости агентству ТАСС заявил президент Российской гильдии риелторов (РГР) Артемий Шурыгин.По его подсчетам, число жилищных сделок с прошлого года упало на 35 процентов, причем заметнее всего показатели просели в новом фонде. Продажи поубавились во всех крупных городах страны. Максимальное падение спроса продемонстрировали Рязань, Сочи, Волгоград, Кострома, Омск, Тюмень, Владивосток, Абакан и Елизово — в этих городах активность на рынке опустилась на 40-70 процентов.В то же время ассортимент на рынке расширился на 12 процентов, отмечает эксперт. За те четыре года действия льготной ипотеки, согласно статистике, объем текущего строительства вырос в 2-2,5 раза. «Поэтому можно сделать вывод, что льготная ипотека не смогла разогнать объемы строительства должным образом», — заключил Шурыгин. По его прогнозам, в течение года — полутора лет предложение на рынке первичной недвижимости станет дефицитным.Снижение продаж в сегменте новостроек отмечают и в Рейтинговом агентстве строительного комплекса. Предполагается, что объем сделок с «первичкой» в 2025 году сократится на 25-30 процентов. Вместе с тем расценки на новый фонд могут опуститься на 5-8 процентов.Это интересно!",россияне стали реже приобретать жилье о снижении уровня продаж на отечественном рынке недвижимости агентству тасс заявил президент российской гильдии риелторов ргр артемий шурыгин по его подсчетам число жилищных сделок с прошлого года упало на  процентов причем заметнее всего показатели просели в новом фонде продажи поубавились во всех крупных городах страны максимальное падение спроса продемонстрировали рязань сочи волгоград кострома омск тюмень владивосток абакан и елизово в этих городах активность на рынке опустилась на   процентов в то же время ассортимент на рынке расширился на  процентов отмечает эксперт за те четыре года действия льготной ипотеки согласно статистике объем текущего строительства вырос в    раза поэтому можно сделать вывод что льготная ипотека не смогла разогнать объемы строительства должным образом заключил шурыгин по его прогнозам в течение года полутора лет предложение на рынке первичной недвижимости станет дефицитным снижение продаж в сегменте новостроек отмечают и в рейтинговом агентстве строительного комплекса предполагается что объем сделок с первичкой в  году сократится на   процентов вместе с тем расценки на новый фонд могут опуститься на   процентов это интересно,2024-12-12
Заголовок отсутствует,https://lenta.ru/news/2024/12/12/rossiyanki-rasskazali-o-spasenii-angelami-hranitelyami-iz-shestichasovogo-snezhnogo-plena/,2024-12-12 19:10:10.394175,"Жительницы Мурманской области оказались в автомобиле в шестичасовом снежном плену при сильнейшем ветре — его порывы достигали 35 метров в секунду. Об этом россиянки рассказали в сообществе «Мурманск ДТП ЧП» во «ВКонтакте».По словам авторов поста, инцидент произошел между населенными пунктами Заозерск и Титовка.«С 5 до 11 часов утра мы оказались закованы в снежном плену (...) Было очень страшно. Мы просили помощи где только возможно. И когда надежда на скорую помощь была на исходе, появились они, наши ангелы-хранители, ребята из Заозерского МЧС», — рассказали о спасении россиянки.В итоге оказавшимся в беде женщинам помогли отогреться и добраться до ближайшего населенного пункта.Ранее сообщалось, что российские пожарные оказали первую помощь сразу 20 кошкам и трем собакам.",жительницы мурманской области оказались в автомобиле в шестичасовом снежном плену при сильнейшем ветре его порывы достигали  метров в секунду об этом россиянки рассказали в сообществе мурманск дтп чп во вконтакте по словам авторов поста инцидент произошел между населенными пунктами заозерск и титовка с  до  часов утра мы оказались закованы в снежном плену было очень страшно мы просили помощи где только возможно и когда надежда на скорую помощь была на исходе появились они наши ангелы хранители ребята из заозерского мчс рассказали о спасении россиянки в итоге оказавшимся в беде женщинам помогли отогреться и добраться до ближайшего населенного пункта ранее сообщалось что российские пожарные оказали первую помощь сразу  кошкам и трем собакам,2024-12-12
Заголовок отсутствует,https://lenta.ru/news/2024/12/12/vasserman-sprognoziroval-razvitie-svo-v-2025-godu/,2024-12-12 19:10:10.506695,"Депутат Госдумы Анатолий Вассерман спрогнозировал развитие специальной военной операции (СВО) на Украине в 2025 году. По его мнению, Российская армия возьмет под контроль весь Донбасс, пишет «Газета.Ru».«Очевидно, Донбасс мы полностью зачистим уже в наступающем году, и тогда движение по остальным землям, оккупированным террористами, пойдет заметно быстрей и замедлится снова, только когда мы выйдем к Карпатским горам», — предположил Вассерман.При этом парламентарий не смог назвать точных сроков взятия Донбасса под контроль России. «Сейчас они [Украина] уже перешли к террору в глубине нашей территории, причем не только путем вербовки (...) — натовцы предоставляют им все более дальнобойные средства в надежде на то, что наш народ испугается и потребует прекратить боевые действия», — порассуждал он. Вассерман заявил, что эта надежда не сбудется, однако Запад и Украина этого пока не понимают. В этой связи дать точный прогноз боевых действий невозможно.По словам депутата, развитие боевых действий зависит от того, как быстро исчерпаются ресурсы НАТО. «По самым оптимистичным оценкам, этот запас исчерпается уже в ближайшие месяцы, а по самым пессимистичным, его хватит еще на несколько лет», — заключил Вассерман.Ранее в Кремле назвали условие завершения СВО. По словам пресс-секретаря российского президента Дмитрия Пескова, цели спецоперации могут быть достигнуты или в результате боевых действий, или по итогам переговоров.",депутат госдумы анатолий вассерман спрогнозировал развитие специальной военной операции сво на украине в  году по его мнению российская армия возьмет под контроль весь донбасс пишет газета ru очевидно донбасс мы полностью зачистим уже в наступающем году и тогда движение по остальным землям оккупированным террористами пойдет заметно быстрей и замедлится снова только когда мы выйдем к карпатским горам предположил вассерман при этом парламентарий не смог назвать точных сроков взятия донбасса под контроль россии сейчас они украина уже перешли к террору в глубине нашей территории причем не только путем вербовки натовцы предоставляют им все более дальнобойные средства в надежде на то что наш народ испугается и потребует прекратить боевые действия порассуждал он вассерман заявил что эта надежда не сбудется однако запад и украина этого пока не понимают в этой связи дать точный прогноз боевых действий невозможно по словам депутата развитие боевых действий зависит от того как быстро исчерпаются ресурсы нато по самым оптимистичным оценкам этот запас исчерпается уже в ближайшие месяцы а по самым пессимистичным его хватит еще на несколько лет заключил вассерман ранее в кремле назвали условие завершения сво по словам пресс секретаря российского президента дмитрия пескова цели спецоперации могут быть достигнуты или в результате боевых действий или по итогам переговоров,2024-12-12
Заголовок отсутствует,https://lenta.ru/news/2024/12/12/v-avstrii-ukraintsu-ne-vydali-grazhdanstvo-iz-za-otkaza-pet-gimn/,2024-12-12 19:10:10.557204,"В Австрии украинцу отказали в выдаче гражданства страны из-за отказа петь австрийский гимн на церемонии вручения. Об этом пишет издание Kurier.«Украинец не получил австрийское гражданство из-за того, что он отказался исполнить государственный гимн на церемонии его вручения в управлении округа Баден», — утверждается в публикации.По данным издания, правительство земли Нижняя Австрия отозвало предоставление гражданства. В материале подчеркивается, что местная администрация сослалась на статью закона о присвоении гражданства, согласно которой процедура вручения должна проходить торжественно и сопровождаться исполнением гимна у флагов.В октябре сыну бывшего президента Украины Виктора Януковича Александру выдали российское гражданство.",в австрии украинцу отказали в выдаче гражданства страны из за отказа петь австрийский гимн на церемонии вручения об этом пишет издание kurier украинец не получил австрийское гражданство из за того что он отказался исполнить государственный гимн на церемонии его вручения в управлении округа баден утверждается в публикации по данным издания правительство земли нижняя австрия отозвало предоставление гражданства в материале подчеркивается что местная администрация сослалась на статью закона о присвоении гражданства согласно которой процедура вручения должна проходить торжественно и сопровождаться исполнением гимна у флагов в октябре сыну бывшего президента украины виктора януковича александру выдали российское гражданство,2024-12-12
Заголовок отсутствует,https://lenta.ru/news/2024/12/12/sestra-kim-kardashyan-povtorila-otkrovennyy-obraz-zheny-kanie-uesta/,2024-12-12 19:10:10.606713,"Телезвезда Хлои Кардашьян повторила откровенный образ жены рэпера Канье Уэста, дизайнера Бьянки Цензори. Об этом сообщает Page Six.Журналисты обратили внимание на снимки 40-летней предпринимательницы в Instagram (запрещенная в России соцсеть; принадлежит компании Meta, признанной экстремистской организацией и запрещенной в РФ). На размещенных кадрах сестра основательница бренда Skims Ким Кардашьян предстала в черном облегающем боди и кружевных колготках.По мнению редакторов, знаменитость скопировала образ Цензори. В марте избранница Уэста поделилась в соцсетях снимком, на котором была запечатлена в розовом корсетном топе, украшенном бантами, и кружевных белых колготках.В августе сообщалось, что пользователи сети уличили Ким Кардашьян в копировании стиля Бьянки Цензори.",телезвезда хлои кардашьян повторила откровенный образ жены рэпера канье уэста дизайнера бьянки цензори об этом сообщает page six журналисты обратили внимание на снимки  летней предпринимательницы в instagram запрещенная в россии соцсеть принадлежит компании meta признанной экстремистской организацией и запрещенной в рф на размещенных кадрах сестра основательница бренда skims ким кардашьян предстала в черном облегающем боди и кружевных колготках по мнению редакторов знаменитость скопировала образ цензори в марте избранница уэста поделилась в соцсетях снимком на котором была запечатлена в розовом корсетном топе украшенном бантами и кружевных белых колготках в августе сообщалось что пользователи сети уличили ким кардашьян в копировании стиля бьянки цензори,2024-12-12
